{
  "automated_scope": [
    "axe violations",
    "keyboard search and focus",
    "route response and semantics",
    "responsive browser matrix",
    "performance budgets",
    "console and page errors",
    "table captions"
  ],
  "coverage_complete": true,
  "data_fingerprint": "084d8ce8ef8e5d5745a05f880607d3929273d786a0e19ea119ea1ac645301281",
  "expected_test_count": 64,
  "human_review_required": true,
  "junit": {
    "errors": 0,
    "failures": 0,
    "skipped": 0,
    "tests": 64
  },
  "project_count": 4,
  "projects": [
    "desktop-chromium",
    "mobile-chromium",
    "desktop-firefox",
    "desktop-webkit"
  ],
  "report_error": null,
  "route_count": 11,
  "routes": [
    "/",
    "/analyses/",
    "/analyses/cognitive_vs_procedural_ratio/",
    "/automation/",
    "/crosswalks/",
    "/demonstrators/",
    "/ontologies/",
    "/readiness/",
    "/roadmap/",
    "/sources/",
    "/sources/au_mbs/"
  ],
  "schema_version": "dashboard-automated-review-v2",
  "screenshot_count": 44,
  "screenshots": [
    {
      "browser": "chromium",
      "browser_version": "149.0.7827.55",
      "byte_size": 590168,
      "file": "embedded",
      "project": "desktop-chromium",
      "route": "/",
      "sha256": "724e26264c1214bbbd3523d3b9ede0b0b787345d1aeae4e709a6c7898cf77dba",
      "viewport": {
        "height": 720,
        "width": 1280
      }
    },
    {
      "browser": "firefox",
      "browser_version": "151.0",
      "byte_size": 284043,
      "file": "embedded",
      "project": "desktop-firefox",
      "route": "/",
      "sha256": "41c7ab81e1faae206332ff922af45fe9923e0c63028416e5659cb126f67dc7c4",
      "viewport": {
        "height": 720,
        "width": 1280
      }
    },
    {
      "browser": "webkit",
      "browser_version": "26.5",
      "byte_size": 361768,
      "file": "embedded",
      "project": "desktop-webkit",
      "route": "/",
      "sha256": "a831f333182299b04bd4bd2b34fb22c4522d05d390201f2ab4bbd5c01d9664c6",
      "viewport": {
        "height": 720,
        "width": 1280
      }
    },
    {
      "browser": "chromium",
      "browser_version": "149.0.7827.55",
      "byte_size": 419871,
      "file": "embedded",
      "project": "mobile-chromium",
      "route": "/",
      "sha256": "00c032311830e3634f48195024e8cbd57d400bcc1aa3c791e0055c5b4fdde9ed",
      "viewport": {
        "height": 727,
        "width": 393
      }
    },
    {
      "browser": "chromium",
      "browser_version": "149.0.7827.55",
      "byte_size": 403769,
      "file": "embedded",
      "project": "desktop-chromium",
      "route": "/analyses/",
      "sha256": "3fcce9562d19fda1010af8547bad0e5a035d9bf6774ba9c9207843865a06f741",
      "viewport": {
        "height": 720,
        "width": 1280
      }
    },
    {
      "browser": "firefox",
      "browser_version": "151.0",
      "byte_size": 414286,
      "file": "embedded",
      "project": "desktop-firefox",
      "route": "/analyses/",
      "sha256": "ccf5147eca2d9c23d21acfffd3ff5c4e3fdfa80d32abaaa088523c1756921da7",
      "viewport": {
        "height": 720,
        "width": 1280
      }
    },
    {
      "browser": "webkit",
      "browser_version": "26.5",
      "byte_size": 494323,
      "file": "embedded",
      "project": "desktop-webkit",
      "route": "/analyses/",
      "sha256": "4214a517b4f4400ed0a7b97e0b8e85596859e6c0a5b2111f5def663f68bc8ad5",
      "viewport": {
        "height": 720,
        "width": 1280
      }
    },
    {
      "browser": "chromium",
      "browser_version": "149.0.7827.55",
      "byte_size": 309644,
      "file": "embedded",
      "project": "mobile-chromium",
      "route": "/analyses/",
      "sha256": "b6fe19c4b9fa07aa528f889eac80b491d62982a7df49ed13467053bc1cfc573c",
      "viewport": {
        "height": 727,
        "width": 393
      }
    },
    {
      "browser": "chromium",
      "browser_version": "149.0.7827.55",
      "byte_size": 208466,
      "file": "embedded",
      "project": "desktop-chromium",
      "route": "/analyses/cognitive_vs_procedural_ratio/",
      "sha256": "3c9ecc706f09a44d0c70fc09ece92f89741d4e19e08cc0318025b8ae8ddfb0ef",
      "viewport": {
        "height": 720,
        "width": 1280
      }
    },
    {
      "browser": "firefox",
      "browser_version": "151.0",
      "byte_size": 189895,
      "file": "embedded",
      "project": "desktop-firefox",
      "route": "/analyses/cognitive_vs_procedural_ratio/",
      "sha256": "e793252b98379ffc05651be98c67fbed0a9c67d816f4574d378a1212ecba3e1e",
      "viewport": {
        "height": 720,
        "width": 1280
      }
    },
    {
      "browser": "webkit",
      "browser_version": "26.5",
      "byte_size": 254896,
      "file": "embedded",
      "project": "desktop-webkit",
      "route": "/analyses/cognitive_vs_procedural_ratio/",
      "sha256": "9461e7e1acf1d24c2ef94b2354319221fb0a175f4fa31f59ebede3c72d88bbe1",
      "viewport": {
        "height": 720,
        "width": 1280
      }
    },
    {
      "browser": "chromium",
      "browser_version": "149.0.7827.55",
      "byte_size": 148321,
      "file": "embedded",
      "project": "mobile-chromium",
      "route": "/analyses/cognitive_vs_procedural_ratio/",
      "sha256": "6c09d32bd87626e571de4e4234351f95d636f731eb53ceacf3f6cc77662c8967",
      "viewport": {
        "height": 727,
        "width": 393
      }
    },
    {
      "browser": "chromium",
      "browser_version": "149.0.7827.55",
      "byte_size": 1361656,
      "file": "embedded",
      "project": "desktop-chromium",
      "route": "/automation/",
      "sha256": "723b79bf106ea48198beb7318b8878a7d0a80307ab8a2035439ce61466180b68",
      "viewport": {
        "height": 720,
        "width": 1280
      }
    },
    {
      "browser": "firefox",
      "browser_version": "151.0",
      "byte_size": 1435694,
      "file": "embedded",
      "project": "desktop-firefox",
      "route": "/automation/",
      "sha256": "546db8c63b438d5724a96fc2df2c31c22f5b59a8ff1ace48fe013d90b2bd492b",
      "viewport": {
        "height": 720,
        "width": 1280
      }
    },
    {
      "browser": "webkit",
      "browser_version": "26.5",
      "byte_size": 1623250,
      "file": "embedded",
      "project": "desktop-webkit",
      "route": "/automation/",
      "sha256": "9d2132c9b18cb488874aa80d5ed4cc75e9f38c55e782d4fcb03e5756797b221f",
      "viewport": {
        "height": 720,
        "width": 1280
      }
    },
    {
      "browser": "chromium",
      "browser_version": "149.0.7827.55",
      "byte_size": 792344,
      "file": "embedded",
      "project": "mobile-chromium",
      "route": "/automation/",
      "sha256": "4aed0a5ff7fb4817b29873fba47011e2c1f8ff2aac5a01be76c8ad521883868e",
      "viewport": {
        "height": 727,
        "width": 393
      }
    },
    {
      "browser": "chromium",
      "browser_version": "149.0.7827.55",
      "byte_size": 533761,
      "file": "embedded",
      "project": "desktop-chromium",
      "route": "/crosswalks/",
      "sha256": "af2ce421dd5e53369f722a8ccd6bdb8f03865cfb01c8dd2c719e83b0220e81b0",
      "viewport": {
        "height": 720,
        "width": 1280
      }
    },
    {
      "browser": "firefox",
      "browser_version": "151.0",
      "byte_size": 546205,
      "file": "embedded",
      "project": "desktop-firefox",
      "route": "/crosswalks/",
      "sha256": "fb00ea29bf338fd821f7c9b7c38cb66b0bb777bb8e28e8aedc12d3d7cec1f192",
      "viewport": {
        "height": 720,
        "width": 1280
      }
    },
    {
      "browser": "webkit",
      "browser_version": "26.5",
      "byte_size": 625762,
      "file": "embedded",
      "project": "desktop-webkit",
      "route": "/crosswalks/",
      "sha256": "91ee72ed8e64c1351f7007a15d9a9a4d078c98c114784d492253d51d9dd8afc1",
      "viewport": {
        "height": 720,
        "width": 1280
      }
    },
    {
      "browser": "chromium",
      "browser_version": "149.0.7827.55",
      "byte_size": 391896,
      "file": "embedded",
      "project": "mobile-chromium",
      "route": "/crosswalks/",
      "sha256": "9f8e7e4c936174b6cfb82415d5ab5df9cb2a15a014f3941d7d0053d9d1d60db5",
      "viewport": {
        "height": 727,
        "width": 393
      }
    },
    {
      "browser": "chromium",
      "browser_version": "149.0.7827.55",
      "byte_size": 197367,
      "file": "embedded",
      "project": "desktop-chromium",
      "route": "/demonstrators/",
      "sha256": "807315280c236d8c603a47ddeb00d973b97111e04ebd10fa20f3f846a0a19a1f",
      "viewport": {
        "height": 720,
        "width": 1280
      }
    },
    {
      "browser": "firefox",
      "browser_version": "151.0",
      "byte_size": 173517,
      "file": "embedded",
      "project": "desktop-firefox",
      "route": "/demonstrators/",
      "sha256": "8d38978e4794e856fca258806e96c82d098fc61483f6c1d336b473c56752c09b",
      "viewport": {
        "height": 720,
        "width": 1280
      }
    },
    {
      "browser": "webkit",
      "browser_version": "26.5",
      "byte_size": 238367,
      "file": "embedded",
      "project": "desktop-webkit",
      "route": "/demonstrators/",
      "sha256": "050f6bee679e7a8e75d3034ea34bd4904f61a1fc31b508e2ab43a1fef22f0740",
      "viewport": {
        "height": 720,
        "width": 1280
      }
    },
    {
      "browser": "chromium",
      "browser_version": "149.0.7827.55",
      "byte_size": 134982,
      "file": "embedded",
      "project": "mobile-chromium",
      "route": "/demonstrators/",
      "sha256": "1e4ada400a86123e8099603e2754cdabf90d85e09c839ee5476290964441e8bc",
      "viewport": {
        "height": 727,
        "width": 393
      }
    },
    {
      "browser": "chromium",
      "browser_version": "149.0.7827.55",
      "byte_size": 314194,
      "file": "embedded",
      "project": "desktop-chromium",
      "route": "/ontologies/",
      "sha256": "98d68835a5580f101d5520a5f0ed46be0a8e0bdf8704f25d6e589fab41a295b2",
      "viewport": {
        "height": 720,
        "width": 1280
      }